Sintoma1;Sintoma2;Sintoma3;Sintoma4;Recomendacion
Diarrea;Anemia;Crecimiento enlentecido;null;Es posible que tenga una enfermedad celíaca. Lo mejor en estas situaciones es dejar de consumir alimentos con gluten. Si es posible visite a un médico para un diagnóstico.
Dolor cervical;Torticolis;Hiperreflexia;Debilidad muscular;Es posible que tenga una inestabilidad atlanto-axial y compresión medular. Acuda a un médico cercano y no exponga al niño a actividad física.
Lagrimeo persistente;Sensibilidad a la luz;Dolor ocular;Estrabismo;Puede haber un daño ocular, el cual debe ser atendido por algún oftalmologo. Derivar a médico lo antes posible.
Prematuro;Dolor de pecho;Fatiga;Aumento de peso;Derivar a médico especialista para ver posibilidad de profilaxis para VRS.
Diarrea;Anemia;null;null;Intente que el niño con síndrome de down consuma alimentos sin gluten, de lo contrario, podría derivar en una enfermedad celíaca. Consultar con un médico especialista si los síntomas persisten
Diarrea;null;null;null;Verifique si el niño padece de fiebre (38.9 °C de temperatura corporal). Hidrate al niño con agua. En caso que la diarrea no mejore después de 2 días, derivar a un médico especialista.
Anemia;null;null;null;Para prevenir la anemia, lo mejor es comer variado. Alimentos con hierro, alimenos cítricos y vitamina b12.
Crecimiento enlentecido;null;null;null;El niño está presentando un crecimiento enlentecido según los datos. Consulte a un médico especialista para ver esta condición en profundidad.
